{
  "id": "0050",
  "slug": "history-of-the-peloponnesian-war",
  "title": "伯罗奔尼撒战争史",
  "author": {
    "name": "修昔底德",
    "era": "公元前5世纪"
  },
  "category": "历史与社会",
  "tags": [
    "古希腊史学",
    "战争史"
  ],
  "language": "zh",
  "rights": {
    "status": "unverified",
    "hostsFullText": false
  },
  "oneSentenceSummary": "修昔底德记述雅典与斯巴达战争的未完成史学著作。"
}
