{
  "id": "0054",
  "slug": "the-social-contract",
  "title": "社会契约论",
  "author": {
    "name": "卢梭",
    "era": "1762年"
  },
  "category": "历史与社会",
  "tags": [
    "启蒙运动",
    "政治哲学"
  ],
  "language": "zh",
  "rights": {
    "status": "unverified",
    "hostsFullText": false
  },
  "oneSentenceSummary": "卢梭论证主权在民与公意的政治哲学著作。"
}
