{
  "id": "0055",
  "slug": "the-spirit-of-laws",
  "title": "论法的精神",
  "author": {
    "name": "孟德斯鸠",
    "era": "1748年"
  },
  "category": "历史与社会",
  "tags": [
    "法学",
    "分权"
  ],
  "language": "zh",
  "rights": {
    "status": "unverified",
    "hostsFullText": false
  },
  "oneSentenceSummary": "孟德斯鸠比较政制与法律、并讨论立法行政司法分权的著作。"
}
