{
  "id": "0087",
  "slug": "crime-and-punishment",
  "title": "罪与罚",
  "author": {
    "name": "陀思妥耶夫斯基",
    "era": "1866年"
  },
  "category": "文学",
  "tags": [
    "长篇小说",
    "俄国"
  ],
  "language": "zh",
  "rights": {
    "status": "unverified",
    "hostsFullText": false
  },
  "oneSentenceSummary": "陀思妥耶夫斯基写穷学生拉斯柯尔尼科夫杀人及其良心折磨的长篇小说。"
}
