{
  "id": "0057",
  "slug": "the-theory-of-moral-sentiments",
  "title": "道德情操论",
  "author": {
    "name": "亚当·斯密",
    "era": "1759年"
  },
  "category": "历史与社会",
  "tags": [
    "伦理学",
    "经济学"
  ],
  "language": "zh",
  "rights": {
    "status": "unverified",
    "hostsFullText": false
  },
  "oneSentenceSummary": "亚当·斯密讨论同情、合宜与道德判断的伦理学著作。"
}
